{
  "filename": "row_132_dash_harvard_edu_extracted",
  "url": "https://dash.harvard.edu/bitstreams/a9643938-23c2-4b01-a6a2-6dcca656100e/download",
  "title": "An Analysis of Payment for Order Flow in American Financial Markets",
  "date": "",
  "sentiment": "Negative",
  "text": "----------------------------------------",
  "text_length": 40,
  "source": "html_extractor",
  "processing_info": {
    "converted_at": "2025-10-02T17:16:35.512189",
    "source_file": "/Users/adamsussman/Documents/606_app/extracted_content/row_132_dash_harvard_edu_extracted.txt"
  }
}