{
  "filename": "row_107_citadelsecurities_com_extracted",
  "url": "https://citadelsecurities.com/wp-content/uploads/sites/2/2022/12/EnhancingCompetitionTransparencyandResiliencyinUSFinancialMarkets.pdf",
  "title": "Enhancing Competition, Transparency, and Resiliency in U.S. Financial Markets",
  "date": "",
  "sentiment": "Positive",
  "text": "----------------------------------------",
  "text_length": 40,
  "source": "html_extractor",
  "processing_info": {
    "converted_at": "2025-10-02T17:16:35.473840",
    "source_file": "/Users/adamsussman/Documents/606_app/extracted_content/row_107_citadelsecurities_com_extracted.txt"
  }
}