{
  "filename": "row_125_edition_cnn_com_extracted",
  "url": "https://edition.cnn.com/2022/12/15/investing/sec-payment-for-order-flow",
  "title": "Massive changes could be coming to the way the stock market functions",
  "date": "",
  "sentiment": "Positive, Negative",
  "text": "----------------------------------------\nWall Street’s top cop has voted in favor of major changes to the way millions of everyday investors buy and sell stocks.\nThe Securities and Exchange Commission Wednesday proposed a rule that it says would add competition to an unseen — but potentially costly — part of the stock trading system for retail investors. The changes won’t be implemented just yet — a vote in the spring could finalize the rules. But the agency is majority controlled by Democrats and the proposal is expected to be adopted next year.\nToday, when you buy or sell a stock on an app, the trade appears to be instantaneous. But beneath that simple buy/sell action is a complex web of Wall Street players exploiting tiny differences in price to rake in huge amounts of cash.\nWhen you tap buy or sell, the broker, such as Robinhood or E*Trade, takes your order to a firm known as a wholesaler or market maker — middlemen firms that are supposed to get you the best price. Wholesalers pay the brokers for the privilege of executing the trades.\nThat process is known as “payment for order flow.” To support free trading, brokers typically make pennies from wholesalers off each transaction — but those pennies add up, accounting for the bulk of brokerages’ revenues. The SEC said the six largest wholesalers collectively paid retail brokers $235 million in payment for order flow for stock orders in the first quarter of 2022.\nPayment for order flow has come under intense scrutiny by regulators following the fallout from the January 2021 run-up in meme stocks like GameStop. The SEC notes that wholesalers typically execute trades “without providing any opportunity for other market participants to compete to provide a better price.”\nThe SEC’s proposed changes would add more competition at the middleman level to ensure retail investors are actually getting the best prices. Orders would be routed into auctions where trading firms would have to compete to execute them.\nSEC Chair Gary Gensler has been a longtime critic of the way the current payment for order flow market operates, arguing that it lacks transparency and competition to the detriment of investors.\nGensler and other critics of the process say the brokers and market makers have conflicts of interest, and that payment for order flow hurts everyday investors while amassing huge wealth for Wall Street firms.\n“Today’s markets are not as fair and competitive as possible for individual investors — everyday retail investors,” Gensler said. “This is in part because there isn’t a level playing field among different parts of the market: wholesalers, dark pools, and lit exchanges.”\nGensler noted that everyday folks don’t have the same benefits as larger, deeper-pocketed investors who are often able to execute orders at the best price possible.\n“The markets have become increasingly hidden from view, especially for individual investors,” Gensler said. “Thus, today’s proposal is designed to bring greater competition in the marketplace for retail market orders.”",
  "text_length": 3045,
  "source": "html_extractor",
  "processing_info": {
    "converted_at": "2025-10-02T17:16:35.509496",
    "source_file": "/Users/adamsussman/Documents/606_app/extracted_content/row_125_edition_cnn_com_extracted.txt"
  }
}