{
  "filename": "row_025_protocol_com_extracted",
  "url": "https://protocol.com/fintech/stock-trading-parkside",
  "title": "Robinhood made stock-trading an app sensation. Parkside Securities wants to take the action global.",
  "date": "2/6/23",
  "sentiment": "Positive",
  "text": "----------------------------------------\nThe resource requested could not be found on this server!",
  "text_length": 98,
  "source": "html_extractor",
  "processing_info": {
    "converted_at": "2025-10-02T17:16:35.514938",
    "source_file": "/Users/adamsussman/Documents/606_app/extracted_content/row_025_protocol_com_extracted.txt"
  }
}