{
  "filename": "row_046_webullapp_com_extracted",
  "url": "https://webullapp.com/news-detail/51113885",
  "title": "SEC Chair Gensler Could Restrict Payment For Order Flow This Week: What Investors Need To Know",
  "date": "7/6/22",
  "sentiment": "Neutral",
  "text": "----------------------------------------\nSEC Chair Gensler Could Restrict Payment For Order Flow This Week: What Investors Need To Know\nGameStop Corp. (NYSE: GME) and AMC Entertainment Holdings Inc (NYSE: AMC) traders at the epicenter of the meme stock trading frenzy in 2021 could get a big update this week on the way brokers like Robinhood Markets In\nGameStop Corp. (NYSE:GME) and AMC Entertainment Holdings Inc (NYSE:AMC) traders at the epicenter of the meme stock trading frenzy in 2021 could get a big update this week on the way brokers like Robinhood Markets Inc (NASDAQ:HOOD) are allowed to run their businesses.\nOn Wednesday, U.S. Securities and Exchange Commission Chair Gary Gensler is speaking at the Piper Sandler Global Exchange and Fintech Conference at 12 p.m. ET. Gensler is expected to detail plans to overhaul the way retail investors' orders are routed, according to the Wall Street Journal.\nRelated Link: After Huge Sell-Offs, Have Robinhood And Peloton Become Buyout Targets?\nWhat Is Payment For Order Flow? Under the current market rules, brokers like Robinhood and Charles Schwab Corporation (NYSE:SCHW) are required to perform \"reasonable diligence\" to determine the best way to route a so-called market order in which the retail trader does not specify a minimum or maximum price for the trade.\nThrough a process called payment for order flow, or PFOF, Robinhood and other brokers receive compensation for routing their orders to specific wholesalers. These wholesalers include Citadel Securities and Virtu Financial Inc (NASDAQ:VIRT).\n“Off-exchange market makers make payments to retail brokers for the privilege of having their customer's orders routed to them first. The market maker will execute directly against the retail order [if they think they can make money from it]. They are basically paying for the privilege of having ‘first dibs’ to trade against the ‘dumb money,'” Benzinga's Premarket Prep co-host Dennis Dick recently said.\nThe End Of PFOF? More than 70% of Robinhood's total revenue in the first quarter of 2022 came from PFOF, which some investors, and even Gensler himself, see as a conflict of interest.\nGameStop and AMC traders accused Citadel Securities of pressuring Robinhood to place trading halts and restrictions on meme stocks in early 2021, although both parties involved deny any such communication took place.\nOn Wednesday, Gensler is expected to detail a new auction process through which firms would bid against each other to win retail traders' order flows.\nIf that change is enacted, it could mean retail investors will be getting better prices on their trades in the near future. It could also mean brokerages like Robinhood will be forced to go back to charging trading commissions if they lose their primary source of revenue.\nBenzinga's Take: PFOF is akin to a hidden trading fee. Rather than the old model of charging traders a flat, upfront fee for each trade, online brokers are now simply selling their order flow to market makers, potentially resulting in lower selling prices and higher purchase prices for their users.",
  "text_length": 3094,
  "source": "html_extractor",
  "processing_info": {
    "converted_at": "2025-10-02T17:16:35.505094",
    "source_file": "/Users/adamsussman/Documents/606_app/extracted_content/row_046_webullapp_com_extracted.txt"
  }
}