{
  "filename": "row_035_protocol_com_extracted",
  "url": "https://protocol.com/crypto-trading-pfof-robinhood",
  "title": "Crypto has a payment for order flow problem, too",
  "date": "2/6/23",
  "sentiment": "Negative",
  "text": "----------------------------------------\nThe resource requested could not be found on this server!",
  "text_length": 98,
  "source": "html_extractor",
  "processing_info": {
    "converted_at": "2025-10-02T17:16:35.504363",
    "source_file": "/Users/adamsussman/Documents/606_app/extracted_content/row_035_protocol_com_extracted.txt"
  }
}