{
  "filename": "row_144_onlinelibrary_wiley_com_extracted",
  "url": "https://onlinelibrary.wiley.com/doi/10.1111/0022-1082.00098",
  "title": "Payments for Order Flow on Nasdaq",
  "date": "",
  "sentiment": "Neutral",
  "text": "----------------------------------------\nVerifying you are human. This may take a few seconds.\nonlinelibrary.wiley.com needs to review the security of your connection before proceeding.",
  "text_length": 185,
  "source": "html_extractor",
  "processing_info": {
    "converted_at": "2025-10-02T17:16:35.509234",
    "source_file": "/Users/adamsussman/Documents/606_app/extracted_content/row_144_onlinelibrary_wiley_com_extracted.txt"
  }
}