{
  "filename": "row_232_papers_ssrn_com_extracted",
  "url": "https://papers.ssrn.com/sol3/papers.cfm?abstract_id=224943",
  "title": "The Allocation of Investors' Orders and Inefficient Market Competition: A Proposal",
  "date": "",
  "sentiment": "Neutral",
  "text": "----------------------------------------\nAn issue that has increasingly occupied the attention of the Securities and Exchange Commission is \"payment for order flow.\" This is the practice whereby securities markets compete for orders placed by brokers by providing side payments to brokers in return for brokers promising to send them investors' orders. Does this create inefficient nonprice competition between securities markets? The paper argues that it does, that all the proposed solutions (including the SEC's disclosure requirements) miss the mark, and that the problem is really a result of the SEC's regulation of the prices at which investors' orders must be filled. Remove this regulatory bar (with a few wrinkles) and the problem would be resolved without the need for the current cumbersome and expensive regulatory apparatus.",
  "text_length": 838,
  "source": "html_extractor",
  "processing_info": {
    "converted_at": "2025-10-02T17:16:35.513391",
    "source_file": "/Users/adamsussman/Documents/606_app/extracted_content/row_232_papers_ssrn_com_extracted.txt"
  }
}