{
  "filename": "row_158_finance_yahoo_com_extracted",
  "url": "https://finance.yahoo.com/news/gensler-zeroes-in-on-citadel-securities-as-sec-considers-payment-for-order-flow-ban-191715790.html",
  "title": "Gensler zeroes in on Citadel Securities as SEC considers payment for order flow ban",
  "date": "",
  "sentiment": "Neutral",
  "text": "----------------------------------------\nWall Street’s top cop said Tuesday that the dominance of Citadel Securities in the business of routing order flow may not be giving retail investors the best deal.\nU.S. Securities and Exchange Commission Chair Gary Gensler told the Senate Banking Committee that he’s concerned about Citadel Securities’ 47% market share over all U.S.-listed retail volume. Virtu Financial (VIRT), another wholesaler, controls about 25% to 30%.\n“I’m pro competition, and I’m not sure the payment for order flow system really is the best competitive landscape,” Gensler said.\nGensler did not mention Citadel Securities by name, but footnotes in the SEC chair’s prepared remarks did.\nThe SEC has not ruled out the possibility of a full ban on payment for order flow, the practice of a brokerage (like Robinhood) passing on stock orders to a wholesaler (like Citadel Securities) to actually locate and execute.\nWhen those wholesalers find a stock at a cheaper price than the investor ordered, the savings are split by the wholesaler and the brokerage — who can then pass on cost savings to the investor in the form of a better price. The payment for order flow model is a major reason why brokerages like Robinhood (HOOD) can offer zero commission trades.\nWholesalers also get rebates from exchanges like the New York Stock Exchange for providing liquidity, entrenching their roles as middlemen in stock trades.\n“I think the inherent conflicts of payment for order flow and rebates on the stock exchanges both may make our markets less efficient,” Gensler said.\nYahoo Finance reported that Gensler raised the issue of concentration of retail order flow in the first meeting of the White House’s Competition Council last Friday, President Joe Biden’s initiative to push federal agencies to curb anti-competitive behavior.\nQuestions remain about how the SEC will proceed on any reform.\nThe former Goldman Sachs banker alluded not only to the possibility of banning payment for order flow, but rethinking rebates and the way that prices are referenced under the benchmarks set by National Best Bid and Offer (NBBO).\n“In this area, it’s all on the table,” Gensler said, adding that the SEC’s single goal is to encourage competition “to lower the cost and raise the efficiency\" of the equity market structure.\nOnce an arcane mechanic of the brokerage industry, payment for order flow earned the national spotlight during the early 2021 frenzy over meme stocks like GameStop (GME).\nRobinhood, which went public in late July, has relied heavily on payment for order flow and saw its revenues from the practice nearly triple in 2020.",
  "text_length": 2645,
  "source": "html_extractor",
  "processing_info": {
    "converted_at": "2025-10-02T17:16:35.497589",
    "source_file": "/Users/adamsussman/Documents/606_app/extracted_content/row_158_finance_yahoo_com_extracted.txt"
  }
}