{
  "filename": "row_150_reuters_com_extracted",
  "url": "https://reuters.com/business/retail-consumer/canada-stock-market-rules-curb-platforms-linked-churning-us-stocks-2021-02-09",
  "title": "Canada stock market rules curb platforms linked to churning U.S. stocks",
  "date": "",
  "sentiment": "Neutral",
  "text": "----------------------------------------",
  "text_length": 40,
  "source": "html_extractor",
  "processing_info": {
    "converted_at": "2025-10-02T17:16:35.504623",
    "source_file": "/Users/adamsussman/Documents/606_app/extracted_content/row_150_reuters_com_extracted.txt"
  }
}