{
  "filename": "row_027_thecoin_news_extracted",
  "url": "https://thecoin.news/articles/robinhoods-shrinking-reliance-payment-order-flow-reflects-growing-role-crypto-revenue-1628020113075",
  "title": "Robinhood's shrinking reliance on payment for order flow reflects the growing role of crypto revenue",
  "date": "2/6/23",
  "sentiment": "Neutral",
  "text": "----------------------------------------\nWhat can I do?\nIf you're a visitor of this website:\nPlease try again in a few minutes.\nIf you're the owner of this website:\nContact your hosting provider letting them know your web server is not completing requests. An Error 522 means that the request was able to connect to your web server, but that the request didn't finish. The most likely cause is that something on your server is hogging resources. Additional troubleshooting information here.",
  "text_length": 490,
  "source": "html_extractor",
  "processing_info": {
    "converted_at": "2025-10-02T17:16:35.471122",
    "source_file": "/Users/adamsussman/Documents/606_app/extracted_content/row_027_thecoin_news_extracted.txt"
  }
}