{
  "filename": "row_005_dailyforex_com_extracted",
  "url": "https://dailyforex.com/comparison/robinhood-vs-etrade",
  "title": "Robinhood vs E*TRADE - Which is better, Robinhood or E*TRADE? Updated 2025",
  "date": "5/4/25",
  "sentiment": "Neutral",
  "text": "----------------------------------------\nRobinhood and E*TRADE are well-known equity brokers, but which one should you trust for your investment portfolios?\nI have conducted an in-depth review of Robinhood vs. E*TRADE to determine which broker is the better overall choice and which traders will benefit most from each.\nHere is a snapshot of the most notable advantages of Robinhood:\n• Share dealing from $1 with an on-ramp for cryptocurrency traders on its mobile app\n• A stainless-steel, branded Visa debit card with 3% cashback on all transactions\nHere is a snapshot of the most notable advantages of E*TRADE:\n• The cutting-edge Power E*TRADE trading platform for active traders, including technical pattern recognition, the Earnings Move Analyzer, and risk/reward probabilities\nBoth brokers offer fractional share investments, stocks, IPOs, ETFs, options, futures, and managed robo-advisories. Robinhood includes gold and select cryptocurrencies, while E*TRADE features mutual funds and bonds.\nHere is why E*TRADE is a better choice for most traders:\nRobinhood and E*TRADE offer commission-free accounts, but which is cheaper?\nRobinhood and E*TRADE provide commission-free equity and ETF trading. The former does not charge contract fees for options and futures trading, while the latter features volume-based options discounts. Therefore, the determination of which option is cheaper depends on the assets, as both brokers offer their own advantages.\nRobinhood has a Gold account for a $5 monthly fee that offers superior trading conditions. Meanwhile E*TRADE lists 18 account types.\nAre there any other noteworthy differences in the account structure between Robinhood and E*TRADE?\nHere is what stands out the most:\n• E*TRADE managed accounts are available under its Core Portfolios service, which requires a minimum deposit of $500\nHow Difficult Is It to Deposit at Robinhood vs. E*TRADE?\nWhile neither broker has a trader-friendly deposit infrastructure, depositing at Robinhood and E*TRADE is as simple as online banking. Robinhood and E*TRADE rely on bank-related payment processors, but Robinhood presents its branded Visa debit card with 3% cashback on all transactions, granting it an edge. Neither broker has a minimum deposit, but select services carry minimums.\nWhich Withdrawal Process Is Better: Robinhood or E*TRADE?\nNeither Robinhood nor E*TRADE has a quality withdrawal process. Robinhood charges a withdrawal fee for withdrawals to external credit/debit cards and bank accounts and favors traders using its branded Visa debit card. E*TRADE prefers clients use banking services provided by its corporate owner, Morgan Stanley. Among bank-related options, ACH transfers are free and the fastest method.\nWhich Broker Is More Secure and Trustworthy?\nRobinhood is one of the pioneers of commission-free trading in the US but has a questionable operational track record, and supplements income with payment for order flow. Morgan Stanley, the corporate owner of E*TRADE, is publicly listed and a well-recognized bank. Both Robinhood and E*TRADE segregate client deposits from corporate funds and are FINRA members, but overall, E*TRADE is more trustworthy.\nWhich Forex Broker Is Better?\nRobinhood and E*TRADE are well-known equity and ETF brokers, and I recommend traders evaluate their products and services to determine which suits their requirements.\nMy analysis has shown that Robinhood offers fractional shares ideal for smaller portfolios but has a controversial track record. The Morgan Stanley acquisition has added banking services and elevated E*TRADE to a prime broker for US clients with excellent price improvement technology.",
  "text_length": 3655,
  "source": "html_extractor",
  "processing_info": {
    "converted_at": "2025-10-02T17:16:35.516558",
    "source_file": "/Users/adamsussman/Documents/606_app/extracted_content/row_005_dailyforex_com_extracted.txt"
  }
}