{
  "filename": "row_189_frontmonth_substack_com_extracted",
  "url": "https://frontmonth.substack.com/p/options-market-structure-101-b18",
  "title": "Options Market Structure 101",
  "date": "",
  "sentiment": "Neutral",
  "text": "----------------------------------------\nThis site requires JavaScript to run correctly. Please",
  "text_length": 95,
  "source": "html_extractor",
  "processing_info": {
    "converted_at": "2025-10-02T17:16:35.508822",
    "source_file": "/Users/adamsussman/Documents/606_app/extracted_content/row_189_frontmonth_substack_com_extracted.txt"
  }
}