{
  "filename": "row_106_academic_oup_com_extracted",
  "url": "https://academic.oup.com/rfs/article/33/4/1484/5526886",
  "title": "Back-Running: Seeking and Hiding Fundamental Information in Order Flows",
  "date": "",
  "sentiment": "Neutral",
  "text": "----------------------------------------\nWhen you visit web sites, they may store or retrieve data in your web browser. This storage is often necessary for basic functionality of the web site or the storage may be used for the purposes of marketing, analytics, and personalization of the web site such as storing your preferences.",
  "text_length": 330,
  "source": "html_extractor",
  "processing_info": {
    "converted_at": "2025-10-02T17:16:35.517938",
    "source_file": "/Users/adamsussman/Documents/606_app/extracted_content/row_106_academic_oup_com_extracted.txt"
  }
}