{
  "filename": "row_120_investing_com_extracted",
  "url": "https://investing.com/news/stock-market-news/highfrequency-traders-love-business-with-robinhood-2268399",
  "title": "High-Frequency Traders Love Business With Robinhood",
  "date": "",
  "sentiment": "Neutral",
  "text": "----------------------------------------\nVerifying you are human. This may take a few seconds.\nwww.investing.com needs to review the security of your connection before proceeding.",
  "text_length": 179,
  "source": "html_extractor",
  "processing_info": {
    "converted_at": "2025-10-02T17:16:35.472546",
    "source_file": "/Users/adamsussman/Documents/606_app/extracted_content/row_120_investing_com_extracted.txt"
  }
}